Name,Definition,Synonym,Output
pseudomembranous conjunctivitis,A acute conjunctivitis which involves a fibrin-rich exudate formation on the surface of the conjunctiva. Infectious causes of pseudomembranes include Corynebacterium diphtheriae,Excessive fetal growth,acute conjunctivitis
serous conjunctivitis except viral,A viral acute conjunctivitis that is characterized by conjunctival inflammation and serous discharge.,serous conjunctivitis,acute conjunctivitis
acute contagious conjunctivitis,A bacterial acute conjunctivitis that is characterized by highly contagious conjunctival hypermia and mucopurulent discharge and has_material basis in Hemophilius Aegypticus.,Pinkeye,acute conjunctivitis
obsolete premature rupture of the fetal membranes,A bacterial acute conjunctivitis that is characterized by highly contagious conjunctival hypermia and mucopurulent discharge and has_material basis in Hemophilius Aegypticus.,Premature rupture of membranes - delivered (disorder),acute conjunctivitis
conjunctival folliculosis,An acute conjunctivitis characterized by conjunctival folliculosis and follicular hypertrophy of the palpebral conjunctivae.,acute follicular conjunctivitis,acute conjunctivitis
obsolete spinal enthesopathy,An acute conjunctivitis characterized by conjunctival folliculosis and follicular hypertrophy of the palpebral conjunctivae.,Spinal enthesopathy (disorder),acute conjunctivitis
