Name,Definition,Synonym,Output
mucinous adenofibroma,An adenofibroma that is characterized by the presence of mucin.,hepatic sarcoma,adenofibroma
uterine corpus adenofibroma,An uterine benign neoplasm that has_material_basis_in glandular and fibrous tissues,adenofibroma of uterine corpus,adenofibroma
clear cell adenofibroma,An adenofibroma that is characterized by the presence of cells with clear cytoplasm.,Clear cell adenofibroma,adenofibroma
fallopian tube adenofibroma,A fallopian tube benign neoplasm that is has_material_basis_in glandular and fibrous tissues,Clear cell adenofibroma,adenofibroma
papillary adenofibroma,An adenofibroma that is characterized by finger-like projections on histology.,Papillary adenofibroma,adenofibroma
obsolete malignant hypertensive heart disease,An adenofibroma that is characterized by finger-like projections on histology.,malignant hypertensive heart disease NOS (disorder),adenofibroma
cystadenofibroma,An ovarian benign neoplasm that is composed_of epithelial ovarian tissue.,Cystadenofibroma,adenofibroma
