Name,Definition,Synonym,Output
chondrocalcinosis,An arthritis that has_material_basis_in the accumulation of salt crystals located_in joint.,pseudogout,arthritis
gout,An arthritis that has_material_basis_in uric acid crystal deposits located_in joint.,Gouty arthropathy,arthritis
adult-onset Still's disease,An arthritis that is a rare from of inflammatory arthritis characterized by fevers,adult-onset Still disease,arthritis
obsolete leukemic reticuloendotheliosis of lymph nodes of inguinal region and lower limb,An arthritis that is a rare from of inflammatory arthritis characterized by fevers,Leukemic reticuloendotheliosis of lymph nodes of inguinal region and/or lower limb (disorder),arthritis
reactive arthritis,An arthritis that is an autoimmune disease which develops due to an infection located elsewhere in the body.,Reiter's disease,arthritis
rheumatoid arthritis,An arthritis that is an autoimmune disease which attacks healthy cells and tissue located_in joint.,atrophic Arthritis,arthritis
obsolete metastatic parathyroid cancer,An arthritis that is an autoimmune disease which attacks healthy cells and tissue located_in joint.,metastatic Parathyroid carcinoma,arthritis
septic arthritis,An arthritis that involves infection by a pathogen located_in joint.,infectious arthritis,arthritis
osteoarthritis,An arthritis that has_material_basis_in worn out cartilage located_in joint.,Osteoarthrosis and allied disorder,arthritis
