Name,Definition,Synonym,Output
invasive bladder transitional cell carcinoma,A Polyomaviridae infectious disease that results_in infection in animals and humans,Invasive bladder Urothelial carcinoma,bladder urothelial carcinoma
non-invasive bladder urothelial carcinoma,A cell type benign neoplasm that is composed_of epithelial tissue in which tumor cells form glands or glandlike structures.,adenomas,bladder urothelial carcinoma
obsolete recurrent adult brain tumor,A cell type benign neoplasm that is composed_of epithelial tissue in which tumor cells form glands or glandlike structures.,relapsed tumor of adult brain,bladder urothelial carcinoma
obsolete Borderline malignancy papillary mucinous cystadenoma,A cell type benign neoplasm that is composed_of epithelial tissue in which tumor cells form glands or glandlike structures.,Papillary mucinous neoplasm of Low malignant Potential,bladder urothelial carcinoma
bladder urothelial papillary carcinoma,An acute inflammation of lacrimal passage that is characterized by inflammation of the lacrimal caniculi,urothelial papillary carcinoma of the bladder,bladder urothelial carcinoma
