Name,Definition,Synonym,Output
sickle cell anemia,A blood protein disease that is characterized by low number of red blood cells,Sickle-cell/Hb-C disease without crisis,blood protein disease
obsolete catatonic type schizophrenia chronic state,A blood protein disease that is characterized by low number of red blood cells,Sickle-cell/Hb-C disease without crisis,blood protein disease
obsolete catatonic schizophrenia,A blood protein disease that is characterized by low number of red blood cells,Sickle-cell/Hb-C disease without crisis,blood protein disease
sulfhemoglobinemia,An anemia that is characterized by a reduction in the number of red blood cells,Sulfhemoglobinemia,blood protein disease
POEMS syndrome,A blood protein disease that is characterized by polyneuropathy,Sexual precocity NOS,blood protein disease
protein S deficiency,A disease of metabolism that has_material_basis_in excessive growth hormone production which results_in enlargement located_in limb.,Protein S deficiency disease,blood protein disease
monoclonal gammopathy of uncertain significance,A blood protein disease that is characterized by the presence of an abnormal protein called monoclonal protein in the blood.,Monoclonal gammopathy of undetermined significance,blood protein disease
obsolete diffuse intraductal papillomatosis,A blood protein disease that is characterized by the presence of an abnormal protein called monoclonal protein in the blood.,Diffuse intraductal papillomatosis,blood protein disease
