Name,Definition,Synonym,Output
Stormorken syndrome,A blood platelet disease characterized by thrombocytopathy,thrombocytopathy,blood platelet disease
MYH-9 related disease,A blood platelet disease that has_material_basis_in mutations in the MYH9 gene. It is characterized by thrombocytopenia,glutamate-aspartate transport defect,blood platelet disease
qualitative platelet defect,A hypersensitivity vasculitis that is characterized by purpura (purplish plaques),Qualitative platelet deficiency,blood platelet disease
thrombocytopenia,A blood platelet disease characterized by low a platelet count in the blood.,Thrombocytopenia Due to Immune Destruction,blood platelet disease
obsolete mesothelial neoplasm,A blood platelet disease characterized by low a platelet count in the blood.,Mesothelial tumor morphology (qualifier value),blood platelet disease
Glanzmann's thrombasthenia,An inherited blood coagulation disease characterized by autosomal recessive inheritance of failure of platelet aggregation and absent or diminished clot retraction that has material_basis_in mutation in the ITGA2B or ITGB3 genes on chromosome 17q21.32.,Thrombocytasthenia,blood platelet disease
platelet storage pool deficiency,An otitis externa involving infection of the tissue surrounding the cartilage of the earlobe (pinna),Platelet storage pool defect,blood platelet disease
thrombocytosis,A blood platelet disease that is characterized by the presence of high platelet counts in the blood.,Thrombocythaemia,blood platelet disease
