Name,Definition,Synonym,Output
amyotrophic neuralgia,A primary bacterial infectious disease that results in infection located in skin,neuralgic amyotrophy,brachial plexus neuropathy
obsolete papilledema associated with decreased ocular pressure,A primary bacterial infectious disease that results in infection located in skin,Papilledema associated with decreased ocular pressure (disorder),brachial plexus neuropathy
brachial plexus neuritis,A mitochondrial encephalomyopathy that is characterized by mitochondrial myopathy,Parsonage-Aldren-Turner syndrome,brachial plexus neuropathy
brachial plexus lesion,A brachial plexus neuropathy characterized by an abnormality,Brachial plexus lesions,brachial plexus neuropathy
obsolete nerve root and plexus disorder,A brachial plexus neuropathy characterized by an abnormality,Brachial plexus lesions,brachial plexus neuropathy
