Name,Definition,Synonym,Output
breast rhabdomyosarcoma,A breast sarcoma that arises from skeletal muscle cells.,Rhabdomyosarcoma of the breast,breast sarcoma
breast angiosarcoma,An angiosarcoma and sarcoma of breast and vascular neoplasm of breast that is located_in the cells that line the blood vessels within the breast or underarm area.,hemangiosarcoma of the breast,breast sarcoma
breast leiomyosarcoma,A breast sarcoma that arises from smooth muscle cells.,leiomyosarcoma of the breast,breast sarcoma
breast hemangiopericytoma,A hemangiopericytoma that is manifested in the breast.,progressive pneumonia of sheep (disorder),breast sarcoma
breast liposarcoma,A breast sarcoma that arises from fat cells.,Liposarcoma of the breast,breast sarcoma
breast fibrosarcoma,A breast sarcoma that arises from fibrous connective tissue and is characterized by the presence of immature proliferating fibroblasts or undifferentiated anaplastic spindle cells in a storiform pattern.,Fibrosarcoma of the breast,breast sarcoma
breast osteosarcoma,A breast sarcoma that arises from bone.,Osteogenic sarcoma of breast,breast sarcoma
