Name,Definition,Synonym,Output
hereditary spherocytosis,A congenital hemolytic anemia characterized by the production of red blood cells with a sphere shape,spherocytic anemia,congenital hemolytic anemia
congenital dyserythropoietic anemia,A congenital hemolytic anemia characterized by ineffective erythropoiesis,congenital dyshaematopoietic anaemia,congenital hemolytic anemia
obsolete acute pyelonephritis with lesion of renal medullary necrosis,A congenital hemolytic anemia characterized by ineffective erythropoiesis,congenital dyshaematopoietic anaemia,congenital hemolytic anemia
hemoglobinopathy,A chronic lymphocytic leukemia that is characterized by over production of B cells (lymphocytes) by the bone marrow where the B cells appear hairy under a microscope.,hemoglobinopathies,congenital hemolytic anemia
congenital nonspherocytic hemolytic anemia,A chronic lymphocytic leukemia that is characterized by over production of B cells (lymphocytes) by the bone marrow where the B cells appear hairy under a microscope.,HNSHA,congenital hemolytic anemia
