Name,Definition,Synonym,Output
small cell osteogenic sarcoma,A connective tissue cancer that has_material_basis_in cells derived from transformed cells that produce cartilage.,small cell Osteosarcoma,conventional central osteosarcoma
telangiectatic osteogenic sarcoma,An acute stress disorder that involves neurotic reactions to unusual,Telangiectatic osteosarcoma,conventional central osteosarcoma
obsolete Epstein-Barr virus related lymphoma,An Epstein-Barr virus infectious disease and is_a lymphoma that derives_from lymphocytes,EBV Related Lymphoma,conventional central osteosarcoma
obsolete intracranial melanoma,An Epstein-Barr virus infectious disease and is_a lymphoma that derives_from lymphocytes,EBV Related Lymphoma,conventional central osteosarcoma
obsolete malignant intracranial neoplasm By Morphology,An Epstein-Barr virus infectious disease and is_a lymphoma that derives_from lymphocytes,EBV Related Lymphoma,conventional central osteosarcoma
intracortical osteogenic sarcoma,A gastrointestinal system disease that is located_in the stomach.,Intracortical osteosarcoma,conventional central osteosarcoma
fibrosarcomatous osteosarcoma,A gastrointestinal system disease that is located_in the stomach.,Fibrosarcomatous Osteogenic sarcoma,conventional central osteosarcoma
