Name,Definition,Synonym,Output
junctional epidermolysis bullosa,An epidermolysis bullosa that is characterized by recurrent blistering located in the lamina lucida of the basement membrane secondary to minor trauma,congenital junctional epidermolysis bullosa,epidermolysis bullosa
epidermolysis bullosa acquisita,An acquired epidermolysis bullosa that is characterized by formation of recurrent blisters secondary to minor trauma in the skin and mucosa,acquired epidermolysis bullosa,epidermolysis bullosa
obsolete visna,A viral infectious disease that results_in infection located_in brain in sheep and goats,Ovine encephalomyelitis,epidermolysis bullosa
epidermolysis bullosa simplex,An epidermolysis bullosa that is characterized by recurrent blistering at the level of the epidermis secondary to minor trauma,Epidermolysis bullosa simplex,epidermolysis bullosa
epidermolysis bullosa dystrophica,An epidermolysis bullosa that is characterized by formation of recurrent blisters secondary to minor trauma in the skin and mucosa,Dystrophic epidermolysis bullosa,epidermolysis bullosa
