Name,Definition,Synonym,Output
thyroid hyalinizing trabecular adenoma,An arthritis that is an autoimmune disease which develops due to an infection located elsewhere in the body.,PLAT,follicular adenoma
fetal adenoma,A lipodystrophy and is_a Human immunodeficiency virus infectious disease that is characterized by loss of subcutaneous fat,Microfollicular adenoma,follicular adenoma
thyroid Hurthle cell adenoma,A thyroid gland follicular carcinoma that is characterized by the presence of large cells with eosinophilic granular cytoplasm and pleomorphic nuclei with prominent,benign oncocytoma of the thyroid,follicular adenoma
obsolete gallbladder cancer unresectable,A thyroid gland follicular carcinoma that is characterized by the presence of large cells with eosinophilic granular cytoplasm and pleomorphic nuclei with prominent,gallbladder carcinoma Unresectable,follicular adenoma
atypical follicular adenoma,A gastrointestinal system disease that involves inflammation of the peritoneum resulting from perforation of the gastrointestinal tract,Atypical follicular adenoma,follicular adenoma
colloid adenoma,An interstitial lung disease involving inflammation of alveoli and smallest airways (bronchioles) of the lung caused by an allergic reaction to inhaled organic dusts containing microorganisms or proteins,Macrofollicular adenoma,follicular adenoma
