Name,Definition,Synonym,Output
gastroparesis,A vulva cancer that is located_in the labium majus.,Gastroparesis syndrome,functional gastric disease
dyspepsia,An ischemia that is characterized by insufficient blood flow to the brain to meet metabolic demand.,indigestion,functional gastric disease
obsolete prostate non-neoplastic disease,An ischemia that is characterized by insufficient blood flow to the brain to meet metabolic demand.,indigestion,functional gastric disease
obsolete coxsackie meningitis,An Enterovirus infectious disease that results_in inflammation located_in meningeal cluster,Meningitis due to coxsackie virus,functional gastric disease
obsolete enterovirus meningitis,An Enterovirus infectious disease that results_in inflammation located_in meningeal cluster,Meningitis due to coxsackie virus,functional gastric disease
