Name,Definition,Synonym,Output
microinvasive gastric cancer,A stomach cancer that is located_in the gastric fundus.,Surface gastric cancer,gastric adenocarcinoma
gastric papillary adenocarcinoma,A papillary adenocarcinoma that is located_in the stomach.,Papillary adenocarcinoma of stomach,gastric adenocarcinoma
obsolete intraductal papillary adenocarcinoma with invasion,A papillary adenocarcinoma that is located_in the stomach.,Intraductal papillary adenocarcinoma with invasion (morphologic abnormality),gastric adenocarcinoma
gastric diffuse adenocarcinoma,An ovary epithelial cancer that is characterized by the presence of finger-like projections on histology.,diffuse type carcinoma,gastric adenocarcinoma
obsolete Lentivirus infectious disease,A Retroviridae infectious disease that results_in infection in animals and humans,Lentivirus disease,gastric adenocarcinoma
gastric cardia adenocarcinoma,A combined T cell and B cell immunodeficiency that is caused by a defect in several genes encoding for B and T lymphocytes resulting in individuals with non-functional immune systems.,adenocarcinoma of gastric cardia,gastric adenocarcinoma
obsolete metastasis to pituitary gland,A combined T cell and B cell immunodeficiency that is caused by a defect in several genes encoding for B and T lymphocytes resulting in individuals with non-functional immune systems.,adenocarcinoma of gastric cardia,gastric adenocarcinoma
gastric tubular adenocarcinoma,A breast adenocarcinoma that is characterized as a well-differentiated invasive carcinoma with regular cells arranged in well-defined tubules (typically one layer thick) surrounded by an abundant fibrohyaline stroma.,tubular adenocarcinoma of stomach,gastric adenocarcinoma
