Name,Definition,Synonym,Output
Gaucher's disease type I,A Gaucher's disease characterized by absence of primary central nervous system involvement that has_material_basis_in a mutation of GBA on chromosome 1q22.,Glucocerebrosidase Deficiency,Gaucher's disease
Gaucher's disease type II,A Gaucher's disease characterized by rapid neurologic deterioration with cranial nerve and extrapyramidal tract involvement that has_material_basis_in an autosomal recessive mutation of GBA on chromosome 1q22.,Infantile Cerebral Gaucher Disease,Gaucher's disease
Gaucher's disease type III,A Gaucher's disease characterized by later onset and slower progession of neurological deterioration compared to type II that has_material_basis_in an autosomal recessive mutation of GBA on chromosome 1q22.,GD III,Gaucher's disease
Gaucher's disease perinatal lethal,A Gaucher's Disease characterized by perinatal lethality and rapid progression of neurological deterioration that has_material_basis_in an autosomal recessive mutation of GBA on chromosome 1q22.,Gaucher Disease,Gaucher's disease
atypical Gaucher's disease due to saposin c deficiency,A Gaucher's disease that has_material_basis_in an autosomal recessive mutation of PSAP on chromosome 10q22.1.,Gaucher Disease,Gaucher's disease
