Name,Definition,Synonym,Output
monogenic disease,A genetic disease that is the result of one or more abnormal alleles and may be dominant,Western European tick-borne encephalitis,genetic disease
obsolete complex genetic disease,A genetic disease that require multiple abnormal alleles to manifest are complex. These diseases are termed multifactorial or polygenic. Expressivity or penetrance of the disease is complex and is associated with multiple genes in combination with lifestyle and environmental factors. Multifactoral genetic diseases include heart disease and diabetes,Western European tick-borne encephalitis,genetic disease
chromosomal disease,A genetic disease that has_material_basis_in extra,skeletal disease,genetic disease
polygenic disease,A genetic disease that is characterized by the additive contributions of variants in multiple genes at different loci.,multiple joint dislocations-short stature-craniofacial dysmorphism-congenital heart defects syndrome,genetic disease
inherited blood coagulation disease,An inherited blood coagulation disease that is characterized by easy bleeding,Hemorrhagic disease,genetic disease
inherited metabolic disorder,A disease of metabolism that is characterized by enzyme deficiency or accumulation of enzymes or toxins which interfere with normal function due to inherited enzyme abnormality.,Metabolic hereditary disorder,genetic disease
