Name,Definition,Synonym,Output
atrioventricular septal defect,A congenital heart septal defect characterized by an abnormal or inadequate fusion of the superior and inferior endocardial cushions with the mid portion of the atrial septum and the muscular portion of the ventricular septum,endocardial cushion defect,heart septal defect
obsolete soft tissue cancer,A congenital heart septal defect characterized by an abnormal or inadequate fusion of the superior and inferior endocardial cushions with the mid portion of the atrial septum and the muscular portion of the ventricular septum,endocardial cushion defect,heart septal defect
obsolete dysplastic nevus,A congenital heart septal defect characterized by an abnormal or inadequate fusion of the superior and inferior endocardial cushions with the mid portion of the atrial septum and the muscular portion of the ventricular septum,nevus of Clark,heart septal defect
ventricular septal defect,A heart septal defect characterized by an opening in the interventricular septum,Ventricular septal abnormality,heart septal defect
atrial heart septal defect,A heart septal defect located_in in the septum that separates the two atria of the heart.,interauricular septal defect,heart septal defect
