Name,Definition,Synonym,Output
autosomal recessive cerebellar ataxia,A hereditary ataxia that has_material_basis_in autosomal recessive inheritance.,clear-cell ovarian carcinoma,hereditary ataxia
spastic ataxia,A hereditary ataxia that is characterized by early onset of cerebellar ataxia,clear-cell ovarian carcinoma,hereditary ataxia
X-linked hereditary ataxia,A hereditary ataxia that is characterized by X-linked inheritance.,clear-cell ovarian carcinoma,hereditary ataxia
autosomal dominant sensory ataxia 1,A hereditary ataxia characterized by gait difficulty and instability especially in dark conditions resulting from sensory loss in the extremities and without cerebellar involvement that has_material_basis_in heterozygous mutations in the RNF170 gene on chromosome 8.,SNAX1,hereditary ataxia
autosomal dominant cerebellar ataxia,A hereditary ataxia that has_material_basis_in autosomal dominant inheritance.,spinocerebellar ataxia,hereditary ataxia
episodic ataxia,A hereditary ataxia characterized by sporadic bouts of ataxia with or without continuous muscle movement.,Isaacs syndrome,hereditary ataxia
obsolete genetic anomaly of leucocyte,A hereditary ataxia characterized by sporadic bouts of ataxia with or without continuous muscle movement.,Isaacs syndrome,hereditary ataxia
