Name,Definition,Synonym,Output
arrhythmogenic right ventricular cardiomyopathy,An intrinsic cardiomyopathy that is characterized by hypokinetic areas involving the free wall of the right ventricle,ARVD,intrinsic cardiomyopathy
left ventricular noncompaction,An intrinsic cardiomyopathy characterized by distinctive (spongy) morphological appearance of the LV myocardium.,left ventricular hypertrabeculation,intrinsic cardiomyopathy
infantile histiocytoid cardiomyopathy,An intrinsic cardiomyopathy characterized by the presence of characteristic pale granular foamy histiocyte-like cells within the myocardium and has_material_basis_in a mutation in the gene encoding mitochondrial cytochrome b.,mandibulofacial dysostosis with microcephaly,intrinsic cardiomyopathy
hypertrophic cardiomyopathy,An intrinsic cardiomyopathy that is characterized by abnormal  thickening (hypertrophy) of the heart without any obvious cause.,hypertrophic obstructive cardiomyopathy,intrinsic cardiomyopathy
obsolete anorectal gonorrhea,An intrinsic cardiomyopathy that is characterized by abnormal  thickening (hypertrophy) of the heart without any obvious cause.,gonococcal proctitis,intrinsic cardiomyopathy
dilated cardiomyopathy,An intrinsic cardiomyopathy that is characterized by an an enlarged heart and damage to the myocardium causing the heart to pump blood inefficiently.,primary dilated cardiomyopathy,intrinsic cardiomyopathy
long QT syndrome,An autosomal genetic disease that is characterized by delayed repolarization of the heart following a heartbeat increases the risk of episodes of torsade de pointes (TDP,Romano-Ward syndrome,intrinsic cardiomyopathy
restrictive cardiomyopathy,A differentiated thyroid gland carcinoma that is characterized by the small mushroom shape of the tumor which has a stem attached to the epithelial layer abd arises from the follicular cells of the thyroid gland.,Restrictive cardiomyopathy,intrinsic cardiomyopathy
