Name,Definition,Synonym,Output
viral labyrinthitis,A labyrinthitis which involves viral infection of the inner ear through the upper airway or the blood stream. The symptoms may include hearing loss and ringing in the ears. If the virus reaches the vestibular system,Viral labyrinthitis,labyrinthitis
purulent labyrinthitis,A labyrinthitis which is a bacterial infectious disease of the inner ear,Suppurative labyrinthitis,labyrinthitis
obsolete intrapelvic lymph node mast cell malignancy,A labyrinthitis which is a bacterial infectious disease of the inner ear,Mast cell malignancy of intrapelvic lymph nodes (disorder),labyrinthitis
focal labyrinthitis,A labyrinthitis which is an infectious inflammatory disease of a circumscribed area of either the vestibular or the cochlear portion of the labyrinth,Circumscribed labyrinthitis,labyrinthitis
toxic labyrinthitis,A labyrinthitis induced by alcohol,Toxic labyrinthitis,labyrinthitis
serous labyrinthitis,A labyrinthitits in which bacterial toxins invade the inner ear. It is the most common complication of acute or chronic middle ear infections.,acute serous labyrinthitis,labyrinthitis
