Name,Definition,Synonym,Output
chronic lymphocytic leukemia,A lymphoblastic leukemia characterized by over production of B-cells and their accumulation in bone marrow and blood.,lymphoplasmacytic leukemia,lymphocytic leukemia
precursor lymphoblastic lymphoma leukemia,A lymphoblastic leukemia that has_material_basis_in immature malignant lymphocytes (lymphoblasts) committed to the B-cell or T-cell lineage and located in bone marrow and located in peripheral blood.,Pterygoid-levator synkinesis,lymphocytic leukemia
obsolete T-cell neoplasm,A lymphoblastic leukemia that has_material_basis_in immature malignant lymphocytes (lymphoblasts) committed to the B-cell or T-cell lineage and located in bone marrow and located in peripheral blood.,Pterygoid-levator synkinesis,lymphocytic leukemia
plasmacytic leukemia,A sinusitis which involves infection of ethmoid sinuses that causes pain or pressure behind and between the eyes,Toxic muscle disease,lymphocytic leukemia
obsolete multiple myeloma and immunoproliferative neoplasm,A sinusitis which involves infection of ethmoid sinuses that causes pain or pressure behind and between the eyes,Toxic muscle disease,lymphocytic leukemia
obsolete abortion complicated by renal failure,A sinusitis which involves infection of ethmoid sinuses that causes pain or pressure behind and between the eyes,Toxic muscle disease,lymphocytic leukemia
acute lymphocytic leukemia,A lymphoblastic leukemia that is characterized by over production of lymphoblasts.,acute lymphoblastic leukemia,lymphocytic leukemia
