Name,Definition,Synonym,Output
pineal region yolk sac tumor,An amnestic disorder that involves the impaired or lost ability to memorize new things.,Pineal Region Yolk Sac neoplasm,malignant pineal area germ cell neoplasm
pineal dysgerminoma,A pneumonia that is an acute inflammation of the lungs induced by inhalation of metal fumes or toxic gases and vapors. It is a sentinel health event (occupational) associated with exposure to ammonia (refrigeration,acute chemical pulmonary edema,malignant pineal area germ cell neoplasm
pineal region choriocarcinoma,A choriocarcinoma that is located_in the testis.,Pineal Choriocarcinoma,malignant pineal area germ cell neoplasm
pineal region teratoma,A stage 0 cancer of the testis consisting of the uniform precursor of testicular germ cell tumors (GCTs). ITGCNU can be found in testicular tissue adjacent to GCTs in approximately 90 percent of adult cases and is found in all groups at risk for testicular cancer,teratoma of Pineal Area,malignant pineal area germ cell neoplasm
pineal region germinoma,A primary bacterial infectious disease that results_in infection located_in skin,Placental infarction,malignant pineal area germ cell neoplasm
