Name,Definition,Synonym,Output
inflammatory myofibroblastic tumor,A mesenchymal cell neoplasm that has_material_basis_in myofibroblastic cells admixed with inflammatory cells.,localized primitive neuroectodermal tumor,mesenchymal cell neoplasm
parachordoma,A cell type benign neoplasm that has_material_basis_in mesothelium.,benign tumor of Mesothelium,mesenchymal cell neoplasm
ossifying fibromyxoid tumor,A cell type benign neoplasm that is composed_of glandular and fibrous tissues,Ossifying Fibromyxoma,mesenchymal cell neoplasm
amyloid tumor,A breast carcinoma that is characterized by an individual having breast cancer in both breasts,Amyloid tumor,mesenchymal cell neoplasm
congenital granular cell tumor,A uterine corpus cancer that has_material_basis_in endometrial stroma and smooth muscle cells.,Stromomyoma,mesenchymal cell neoplasm
nonossifying fibromyxoid tumor,A uterine corpus cancer that has_material_basis_in endometrial stroma and smooth muscle cells.,Nonossifying Fibromyxoma,mesenchymal cell neoplasm
