Name,Definition,Synonym,Output
bronchus mucoepidermoid carcinoma,A bronchus cancer that has_material_basis_in squamous cells,appendix carcinoid endocrine tumour,mucoepidermoid carcinoma
trachea mucoepidermoid carcinoma,A trachea carcinoma that is characterized by the presence of squamous cells,appendix carcinoid endocrine tumour,mucoepidermoid carcinoma
thymus mucoepidermoid carcinoma,A corneal disease that is characterized by inflammation of the cornea.,Mucoepidermoid carcinoma of the Thymus,mucoepidermoid carcinoma
lacrimal gland mucoepidermoid carcinoma,A breast carcinoma that represents a mixed group of malignant neoplasms characterized by the histologic presence of two or more cellular types.,Mucoepidermoid carcinoma of the lacrimal gland,mucoepidermoid carcinoma
laryngeal mucoepidermoid carcinoma,A thyroid gland carcinoma that is composed of groups of squamoid and mucous cells,Mucoepidermoid carcinoma of Larynx,mucoepidermoid carcinoma
