Name,Definition,Synonym,Output
transient myeloproliferative syndrome,A myeloproliferative neoplasm characterized by leukocytosis in newborns with Down syndrome and rarely in non-Down's infants.,transient myeloproliferative disease,myeloproliferative neoplasm
myeloproliferative disorder with eosinophilia,A myeloproliferative neoplasm characterized by chronic proliferation of myeloid cells and eosinophilia in the peripheral blood and bone marrow that has_material_basis_in a fusion of ETV6 and PDGFRB formed by a translocation from chromosome 12 to chromosome 5q32.,chronic myeloproliferative disorder with eosinophilia,myeloproliferative neoplasm
essential thrombocythemia,A myeloproliferative neoplasm that is characterized by sustained thrombocytosis in the blood,primary Thrombocytosis,myeloproliferative neoplasm
obsolete megakaryocytic tumor,A myeloproliferative neoplasm that is characterized by sustained thrombocytosis in the blood,primary Thrombocytosis,myeloproliferative neoplasm
polycythemia vera,A primary polycythemia and a myeloproliferative neoplasm characterized by erythroid hyperplasia,Proliferative polycythaemia,myeloproliferative neoplasm
