Name,Definition,Synonym,Output
myeloid and lymphoid neoplasms with eosinophilia and abnormalities of PDGFRA,A myeloid neoplasm that is characterized by the formation of abnormal fusion genes that encode constitutively activated tyrosine kinases.,Myeloid and Lymphoid Neoplasms with Eosinophilia and Rearrangement of PDGFRA,myeloid neoplasm
myeloproliferative neoplasm,A myeloid neoplasm that is characterized by a group of slow growing blood cancers in which large numbers of abnormal red blood cells,CMPD,myeloid neoplasm
obsolete malignant neoplasm of lymphatic and hemopoietic tissue,A myeloid neoplasm that is characterized by a group of slow growing blood cancers in which large numbers of abnormal red blood cells,CMPD,myeloid neoplasm
myelofibrosis,A myeloid neoplasm that is located in the bone marrow which results in bone marrow being replaced by fibrous (scar) tissue.,primary myelofibrosis,myeloid neoplasm
myelodysplastic myeloproliferative neoplasm,A myeloid neoplasm that results_in the overproduction of white blood cells.,Myeloproliferative/Myelodysplastic syndromes,myeloid neoplasm
