Name,Definition,Synonym,Output
prostate neuroendocrine neoplasm,A carcinoma that has_material_basis_in abnormally proliferating cells,neuroendocrine tumor of the prostate,neuroendocrine tumor
somatostatinoma,A reading disorder resulting from a developmental reading disability involving the inability to process graphic symbols resulting in impairment of reading ability.,Somatostatin cell tumour,neuroendocrine tumor
VIPoma,A viral infectious disease that results_in infection in swine,Vipoma,neuroendocrine tumor
obsolete delayed puberty,A viral infectious disease that results_in infection in swine,Delayed puberty NOS,neuroendocrine tumor
gastrinoma,A neuroendocrine tumor that results_in an overproduction of gastric acid.,malignant gastrinoma,neuroendocrine tumor
obsolete small intestinal gastrinoma,A neuroendocrine tumor that results_in an overproduction of gastric acid.,small intestinal G-cell gastrin producing tumor,neuroendocrine tumor
