Name,Definition,Synonym,Output
residual stage of open angle glaucoma,A tauopathy that is characterized by memory lapses,Residual stage of open angle glaucoma,open-angle glaucoma
primary open angle glaucoma,An open-angle glaucoma that is characterized by the absence of any apparent obstruction of aqueous outflow through the trabecular meshwork with gonioscopy,chronic simple glaucoma,open-angle glaucoma
obsolete passive-aggressive personality disorder,An open-angle glaucoma that is characterized by the absence of any apparent obstruction of aqueous outflow through the trabecular meshwork with gonioscopy,passive-aggressive personality disorder,open-angle glaucoma
obsolete meningococcal septicemia,An open-angle glaucoma that is characterized by the absence of any apparent obstruction of aqueous outflow through the trabecular meshwork with gonioscopy,Meningococcemia,open-angle glaucoma
low tension glaucoma,A parathyroid gland disease characterized by an overactivity of the parathyroid glands,Normal tension glaucoma,open-angle glaucoma
