Name,Definition,Synonym,Output
insulinoma,A pancreatic cystadenoma that is characterized by the overproduction of insulin.,Islet cell adenoma,pancreatic cystadenoma
pancreatic serous cystadenoma,A lung cancer that derives_from epithelial cells of glandular origin.,Low Malignancy Potential serous Cystadenoma,pancreatic cystadenoma
microcystic adenoma,A pancreatic cystadenoma that is characterized by innumerable small cysts lined by bland clear cells.,Microcystic adenoma,pancreatic cystadenoma
obsolete atypical adenoma,A pancreatic cystadenoma that is characterized by innumerable small cysts lined by bland clear cells.,Atypical adenoma (morphologic abnormality),pancreatic cystadenoma
pancreatic mucinous cystadenoma,A central nervous system adult germ cell tumor that develops from mismigrational pluripotent embryonic cells that remain in the brain after birth,pancreatic mucinous cystic neoplasm,pancreatic cystadenoma
pancreatic colloid cystadenoma,An adolescence-adult electroclinical syndrome starting in adolescence exhibiting generalized tonic-clonic seizures as the only seizure type.,mucinous Cystadenoma of pancreas,pancreatic cystadenoma
