Name,Definition,Synonym,Output
pancreatic squamous cell carcinoma,A squamous cell carcinoma located in the pancreas.,XMEN,pancreatic cancer
pancreas lymphoma,A carcinoma that is located_in the inside of the abdomen.,Lymphoma of pancreas,pancreatic cancer
tumor of exocrine pancreas,An endocrine gland cancer located_in the pancreas.,pancreatic Exocrine tumor,pancreatic cancer
pancreas sarcoma,A pancreatic cancer that is located_in the pancreas and that arises from transformed cells of mesenchymal origin.,sarcoma of pancreas,pancreatic cancer
islet cell tumor,A pancreatic cancer that is located_in the pancreatic islet cells.,pancreatic Endocrine neoplasm,pancreatic cancer
pancreatic adenosquamous carcinoma,A pancreatic ductal carcinoma that derives_from squamous cells and gland-like cells.,adenosquamous carcinoma of the pancreas,pancreatic cancer
