Name,Definition,Synonym,Output
parasitic Ichthyosporea infectious disease,A parasitic infectious disease that involves parasitic infection by the members of the class Ichthyosporea,urogenital trichomonas,parasitic infectious disease
parasitic protozoa infectious disease,A parasitic infectious disease that is caused by parasitic protozoa which are microorganisms classified as unicellular eukaryotes.,sarcomastigophora infectious disease,parasitic infectious disease
parasitic ectoparasitic infectious disease,A parasitic infectious disease that is caused by organisms that live primarily on the surface of the host.,ectoparasitism,parasitic infectious disease
parasitic helminthiasis infectious disease,A parasitic infectious disease that occurs when part of the body is infested with parasitic worms such as cestodes,worm infection,parasitic infectious disease
obsolete Hodgkin's lymphoma,A parasitic infectious disease that occurs when part of the body is infested with parasitic worms such as cestodes,Hodgkin's disease,parasitic infectious disease
obsolete Burkitt's tumor or lymphoma involving lymph nodes of head,A parasitic infectious disease that occurs when part of the body is infested with parasitic worms such as cestodes,Burkitt's tumor or lymphoma involving lymph nodes of head,parasitic infectious disease
obsolete Hodgkin's lymphoma,A parasitic infectious disease that occurs when part of the body is infested with parasitic worms such as cestodes,Hodgkin's disease,parasitic infectious disease
