Name,Definition,Synonym,Output
primary spontaneous pneumothorax,A lipid storage disease characterized by lysosomal and lipase deficiency.,Primary mediastinal clear cell lymphoma of B-cell type,pneumothorax
spontaneous tension pneumothorax,An embryonal cancer that are masses of rapidly growing cells that originates in embryonic (fetal) tissue in the brain and spinal cord.,Behcet syndrome arthropathy,pneumothorax
hemopneumothorax,An autosomal recessive disease characterized by sun sensitivity,Congenital Telangiectatic Erythema syndrome,pneumothorax
tuberculous pneumothorax,A pneumothorax in which air enters into the pleural cavity.,Laron-type isolated somatotropin defect,pneumothorax
obsolete Arenavirus hemorrhagic fever,A viral infectious disease that involves fever and bleeding disorder caused by Arenavirus.,arenaviral hemorrhagic fever,pneumothorax
