Name,Definition,Synonym,Output
sebaceous carcinoma,A carcinoma that derives_from myoepithelial cells.,malignant Sebaceous tumor,sebaceous gland disease
obsolete malignant tumor of epidermal appendage,A carcinoma that derives_from myoepithelial cells.,malignant tumor of epidermal appendage (disorder),sebaceous gland disease
acne,A sebaceous gland disease characterized by areas of blackheads,frontalis acne,sebaceous gland disease
obsolete atypical meningioma,A sebaceous gland disease characterized by areas of blackheads,Atypical meningioma (morphologic abnormality),sebaceous gland disease
obsolete adult atypical meningioma,A sebaceous gland disease characterized by areas of blackheads,Atypical meningioma (morphologic abnormality),sebaceous gland disease
obsolete secondary cardiac lymphoma,A sebaceous gland disease characterized by areas of blackheads,secondary Heart Lymphoma,sebaceous gland disease
follicular mucinosis,A blepharitis that is characterized as a cyst in the eyelid that is caused by inflammation of a blocked meibomian gland,Alopecia mucinosa,sebaceous gland disease
