Name,Definition,Synonym,Output
X-linked sideroblastic anemia with ataxia,A sideroblastic anemia that is characterized by decreased production of hemoglobin and ataxia and has_material_basis_in the mutation in the ABCB7 gene.,X-linked sideroblastic anemia and ataxia,sideroblastic anemia
obsolete infantile onset spinocerebellar ataxia,An autosomal recessive cerebellar ataxia that is characterized by progressive ataxia,X-linked sideroblastic anemia and ataxia,sideroblastic anemia
sideroblastic anemia 1,A sideoblastic anemia that is characterized by the presence of microcytic hypochromic anemia and iron overload,XLSA,sideroblastic anemia
obsolete sideroblastic anemia with spinocerebellar ataxia,A sideoblastic anemia that is characterized by microcytic hypochromic anemia and ealy-onset,ASAT,sideroblastic anemia
autosomal recessive pyridoxine-refractory sideroblastic anemia 2,A sideroblastic anemia that is characterized by microcytic hypochromic anemia and iron overload,pyridoxine-refractory autosomal recessive sideroblastic anemia,sideroblastic anemia
pyridoxine-responsive sideroblastic anemia,A sideoblastic anemia that is characterized by the presence of microcytic hypochromic anemia and iron overload,pyridoxine-refractory autosomal recessive sideroblastic anemia,sideroblastic anemia
autosomal dominant sideroblastic anemia 4,A sideroblastic anemia characterized by an autosomal dominant inheritance pattern.,MC5DN4,sideroblastic anemia
sideroblastic anemia with B-cell immunodeficiency,A sideroblastic anemia characterized by onset of severe sideroblastic anemia in the neonatal period or infancy,SIFD,sideroblastic anemia
autosomal recessive pyridoxine-refractory sideroblastic anemia 3,A sideroblastic anemia that is characterized by homozygous or compound heterozygous mutation in the GLRX5 gene on chromosome 14q32.,Familial bicuspid aortic valve,sideroblastic anemia
