Name,Definition,Synonym,Output
keratoacanthoma,An inherited metabolic disorder that involves the creation and degradation of lipids.,Unilateral Segmental Cavernous hemangioma of the skin,skin squamous cell carcinoma
plantar verrucous skin carcinoma,A cancer of urethra that shows squamous cell differentiation.,urethral Epidermoid carcinoma,skin squamous cell carcinoma
sarcomatoid squamous cell skin carcinoma,A squamous cell carcinoma that is located_in the gallbladder.,squamous cell carcinoma,skin squamous cell carcinoma
acantholytic squamous cell skin carcinoma,A male reproductive organ cancer that has_material_basis_in abnormally proliferating cells derives_from epithelial cells and is_located_in the Cowper's gland.,Acantholytic squamous cell skin carcinoma,skin squamous cell carcinoma
pseudovascular skin squamous cell carcinoma,A mature teratoma that has_material_basis in gastric tissue.,metastatic extraskeletal Ewing's sarcoma,skin squamous cell carcinoma
clear cell squamous cell skin carcinoma,A gastrointestinal system disease that involves inflammation of the peritoneum resulting from perforation of the gastrointestinal tract,Clear cell squamous cell skin carcinoma,skin squamous cell carcinoma
obsolete breast adenolipoma,A gastrointestinal system disease that involves inflammation of the peritoneum resulting from perforation of the gastrointestinal tract,Clear cell squamous cell skin carcinoma,skin squamous cell carcinoma
obsolete crystal arthropathy,A gastrointestinal system disease that involves inflammation of the peritoneum resulting from perforation of the gastrointestinal tract,Unspecified crystal arthropathy involving upper arm,skin squamous cell carcinoma
