Name,Definition,Synonym,Output
chronic sphenoidal sinusitis,A sphenoid sinusitis which lasts for 12 weeks or more.,Sphenoidal sinus-chr.,sphenoid sinusitis
acute sphenoidal sinusitis,A sphenoid sinusitis which lasts for less than 4 weeks.,Sphenoidal sinus -acute,sphenoid sinusitis
obsolete Ancylostoma braziliense ancylostomiasis,An ancylostomiasis that is characterized by skin manifestations (cutaneous larva migrans) occuring due to migrating larvae of Ancylostoma braziliense in the upper epidermis. It is marked by the presence of erythematous,Ancylostomiasis due to Ancylostoma braziliense (disorder),sphenoid sinusitis
obsolete Ancylostoma duodenale ancylostomiasis,An ancylostomiasis that involves parasitic infection of the small intestine in humans,Ancylostomiasis due to Ancylostoma duodenale (disorder),sphenoid sinusitis
obsolete AIDS dementia complex,A HIV encephalopathy that results_in infection in adults located_in brain,HIV-associated dementia,sphenoid sinusitis
