Name,Definition,Synonym,Output
eccrine sweat gland neoplasm,An organ system cancer that is located in the peritoneum.,Eccrine tumor,sweat gland neoplasm
obsolete histoplasmosis pneumonia,A pneumonia that results_in inflammation located_in lung,Pneumonia with histoplasmosis (disorder),sweat gland neoplasm
syringoma,A vulvar benign neoplasm that is characterized by the comma tadpole shaped tail of dilated,nodular hidradenoma,sweat gland neoplasm
myoepithelioma,A sweat gland neoplasm that is composed_of outgrowths of myoepithelial cells from a sweat gland.,Myoepithelial neoplasm,sweat gland neoplasm
hidradenoma,A sweat gland neoplasm that is located_in an apical sweat gland.,Syringoadenoma,sweat gland neoplasm
obsolete skin appendage adenoma,A sweat gland neoplasm that is located_in an apical sweat gland.,skin appendage adenoma (morphologic abnormality),sweat gland neoplasm
obsolete skin appendage neoplasm,A sweat gland neoplasm that is located_in an apical sweat gland.,Adnexal and skin appendage tumor (qualifier value),sweat gland neoplasm
obsolete venous problem,A sweat gland neoplasm that is located_in an apical sweat gland.,postpartum deep-vein thrombosis,sweat gland neoplasm
apocrine sweat gland neoplasm,An organ system cancer located_in the retroperitoneal space that is manifested in retroperitoneal space in the abdominal cavity behind the peritoneum.,Apocrine tumor,sweat gland neoplasm
