Name,Definition,Synonym,Output
thymus lipoma,An immune system organ benign neoplasm that is located_in the thymus and derives_from fat cells.,Thymolipoma,thymus gland disease
obsolete lipoma of the mediastinum,An immune system organ benign neoplasm that is located_in the thymus and derives_from fat cells.,Lipoma of mediastinum,thymus gland disease
obsolete juxtapapillary focal choroiditis and chorioretinitis,An immune system organ benign neoplasm that is located_in the thymus and derives_from fat cells.,Juxtapapillary focal choroiditis AND chorioretinitis (disorder),thymus gland disease
thymus cancer,An immune system cancer located_in the thymus.,Thymic tumor,thymus gland disease
ectopic thymus,A disease that has_material_basis_in genetic variations in the human genome.,basal cell carcinoma of the prostate,thymus gland disease
obsolete metastatic transitional cell cancer of the renal pelvis and ureter,A disease that has_material_basis_in genetic variations in the human genome.,metastatic Urothelial carcinoma of the renal Pelvis and Ureter,thymus gland disease
thymic dysplasia,An ovarian disease that is characterized by the presence of nests of luteinized theca cells scattered throughout the ovary,urethra metastatic malignant neoplasm,thymus gland disease
obsolete localized Askin's tumor,An ovarian disease that is characterized by the presence of nests of luteinized theca cells scattered throughout the ovary,urethra metastatic malignant neoplasm,thymus gland disease
obsolete diencephalic anaplastic astrocytoma,An ovarian disease that is characterized by the presence of nests of luteinized theca cells scattered throughout the ovary,Undifferentiated astrocytoma of Diencephalon,thymus gland disease
