Name,Definition,Synonym,Output
tooth agenesis,A tooth disease characterized by failure to develop on or more missing teeth.,selective tooth agenesis,tooth disease
dental abscess,A tooth disease characterized by a localized collection of pus associated with a tooth.,circulatory arrest,tooth disease
primary failure of tooth eruption,A tooth disease characterized by incomplete tooth eruption despite the presence of a clear eruption pathway that has_material_basis_in heterozygous mutation in PTHR1 on chromosome 3p21.31.,unerupted second primary molar,tooth disease
dental fluorosis,An uterine benign neoplasm that is characterized by the formation of gland-like structures,Mottling of enamel,tooth disease
anodontia,An uterine benign neoplasm that is characterized by the formation of gland-like structures,Total anodontia of permanent and deciduous teeth,tooth disease
teeth hard tissue disease,A central nervous system cancer develops from transformed cells of mesenchymal origin located_in brain and spine,tumor of the Paraurethral gland,tooth disease
periodontal disease,A vaginitis that is characterized by a grayish vaginal discharge usually of foul odor and the presence of Gardnerella vaginalis.,periodontium disorder,tooth disease
dentinogenesis imperfecta,A chordoma that derives_from the spine.,Chordoma of Spine,tooth disease
periodontosis,A myopathy is characterized by progressive skeletal muscle weakness degeneration.,Marable's syndrome,tooth disease
