Name,Definition,Synonym,Output
trichostrongylosis,A trichostrongyloidiasis that involves infection of the small intestine with Trichostrongylus colubriformis or Trichostrongylus axei,Trichostrongyliasis,trichostrongyloidiasis
obsolete catatonic type schizophrenia subchronic state,A trichostrongyloidiasis that involves infection of the small intestine with Trichostrongylus colubriformis or Trichostrongylus axei,Trichostrongyliasis,trichostrongyloidiasis
obsolete catatonic type schizophrenia subchronic state with acute exacerbation,A trichostrongyloidiasis that involves infection of the small intestine with Trichostrongylus colubriformis or Trichostrongylus axei,Trichostrongyliasis,trichostrongyloidiasis
obsolete catatonic type schizophrenia chronic state with acute exacerbation,A trichostrongyloidiasis that involves infection of the small intestine with Trichostrongylus colubriformis or Trichostrongylus axei,Trichostrongyliasis,trichostrongyloidiasis
haemonchiasis,A trichostrongyloidiasis that involves parasitic infection of the ruminant abomasum by nematodes of the genus Haemonchus resulting in anemia,Frontal lobe epilepsy,trichostrongyloidiasis
ostertagiasis,A trichostrongyloidiasis that involves parasitic infection of the ruminant gastrointestinal tract by nematodes of the genus Ostertagia.,Infection by Strongylus equinus (disorder),trichostrongyloidiasis
