Name,Definition,Synonym,Output
autoimmune uveitis,An autoimmune disease of eyes,PVAN,uveal disease
uveitis,A uveal disease is characterized by inflammation of any of the layers of the uvea of the eye,Wasting disease,uveal disease
choroid disease,A spinal cancer that is located_in the spinal cord and derives_from lymphocytes.,hyperactive labyrinth,uveal disease
iris disease,A female reproductive organ cancer that is located_in the ovary.,Clear cell tumor of ovary (disorder),uveal disease
uveal cancer,A thoracic disease that is located_in the breast.,Uveal tumor,uveal disease
